{
  "schema_version": 1,
  "id": "sunblaze",
  "status": "active",
  "titles": {
    "primary": "Sunblaze",
    "ja": "Sunblaze",
    "en": "Sunblaze"
  },
  "aliases": [
    {
      "text": "Sunblaze",
      "normalized": "sunblaze",
      "kind": "official",
      "source": "steam_store:1525660"
    }
  ],
  "releases": [],
  "companies": [],
  "platforms": [
    "PC (Steam)"
  ],
  "external_ids": {
    "steam_app": 1525660
  },
  "sales_observations": [],
  "verification": {
    "status": "partially_verified",
    "checked_at": "2026-08-30",
    "sources": [
      {
        "type": "steam_store",
        "ref": "https://store.steampowered.com/app/1525660/"
      }
    ]
  }
}
