{
  "schema_version": 1,
  "id": "yarimono",
  "status": "active",
  "titles": {
    "primary": "ヤリモノ",
    "ja": "ヤリモノ",
    "en": "Yarimono"
  },
  "aliases": [
    {
      "text": "ヤリモノ",
      "normalized": "ヤリモノ",
      "kind": "official",
      "source": "steam_store:2696050"
    },
    {
      "text": "Yarimono",
      "normalized": "yarimono",
      "kind": "official",
      "source": "steam_store:2696050"
    }
  ],
  "releases": [],
  "companies": [],
  "platforms": [
    "PC (Steam)"
  ],
  "external_ids": {
    "steam_app": 2696050
  },
  "sales_observations": [],
  "verification": {
    "status": "partially_verified",
    "checked_at": "2026-08-30",
    "sources": [
      {
        "type": "steam_store",
        "ref": "https://store.steampowered.com/app/2696050/"
      }
    ]
  }
}
