{
  "schema_version": 1,
  "id": "cute-broke-and-dungeon-bound",
  "status": "active",
  "titles": {
    "primary": "超絶美少女のRPG~ガチャとティーナとダンジョン~",
    "ja": "超絶美少女のRPG~ガチャとティーナとダンジョン~",
    "en": "Cute, Broke, and Dungeon Bound"
  },
  "aliases": [
    {
      "text": "超絶美少女のRPG~ガチャとティーナとダンジョン~",
      "normalized": "超絶美少女のrpg~ガチャとティーナとダンジョン~",
      "kind": "official",
      "source": "steam_store:3490890"
    },
    {
      "text": "Cute, Broke, and Dungeon Bound",
      "normalized": "cute, broke, and dungeon bound",
      "kind": "official",
      "source": "steam_store:3490890"
    }
  ],
  "releases": [],
  "companies": [],
  "platforms": [
    "PC (Steam)"
  ],
  "external_ids": {
    "steam_app": 3490890
  },
  "sales_observations": [],
  "verification": {
    "status": "partially_verified",
    "checked_at": "2026-08-30",
    "sources": [
      {
        "type": "steam_store",
        "ref": "https://store.steampowered.com/app/3490890/"
      }
    ]
  }
}
