{
  "schema_version": 1,
  "id": "hades",
  "status": "active",
  "titles": {
    "primary": "Hades",
    "ja": null,
    "en": null
  },
  "aliases": [
    {
      "text": "hades",
      "normalized": "hades",
      "kind": "seed",
      "source": "stream_pulse_seed"
    },
    {
      "text": "ハデス",
      "normalized": "ハデス",
      "kind": "seed",
      "source": "stream_pulse_seed"
    }
  ],
  "releases": [],
  "companies": [],
  "platforms": [],
  "external_ids": {},
  "sales_observations": [],
  "verification": {
    "status": "seed_unverified",
    "checked_at": null,
    "sources": [
      {
        "type": "stream_pulse",
        "ref": "config/game_master.json"
      },
      {
        "type": "stream_pulse",
        "ref": "config/aliases.json"
      }
    ]
  }
}
