{
  "schema_version": 1,
  "id": "the-use-of-life",
  "status": "active",
  "titles": {
    "primary": "いのちのつかいかた",
    "ja": "いのちのつかいかた",
    "en": "The Use of Life"
  },
  "aliases": [
    {
      "text": "いのちのつかいかた",
      "normalized": "いのちのつかいかた",
      "kind": "official",
      "source": "steam_store:1483370"
    },
    {
      "text": "The Use of Life",
      "normalized": "the use of life",
      "kind": "official",
      "source": "steam_store:1483370"
    }
  ],
  "releases": [],
  "companies": [],
  "platforms": [
    "PC (Steam)"
  ],
  "external_ids": {
    "steam_app": 1483370
  },
  "sales_observations": [],
  "verification": {
    "status": "partially_verified",
    "checked_at": "2026-08-30",
    "sources": [
      {
        "type": "steam_store",
        "ref": "https://store.steampowered.com/app/1483370/"
      }
    ]
  }
}
