{
  "schema_version": 1,
  "id": "beats-of-betrayal",
  "status": "active",
  "titles": {
    "primary": "Beats of Betrayal",
    "ja": "Beats of Betrayal",
    "en": "Beats of Betrayal"
  },
  "aliases": [
    {
      "text": "Beats of Betrayal",
      "normalized": "beats of betrayal",
      "kind": "official",
      "source": "steam_store:2761340"
    }
  ],
  "releases": [],
  "companies": [],
  "platforms": [
    "PC (Steam)"
  ],
  "external_ids": {
    "steam_app": 2761340
  },
  "sales_observations": [],
  "verification": {
    "status": "partially_verified",
    "checked_at": "2026-08-30",
    "sources": [
      {
        "type": "steam_store",
        "ref": "https://store.steampowered.com/app/2761340/"
      }
    ]
  }
}
