{
  "schema_version": 1,
  "id": "tetris-forever",
  "status": "active",
  "titles": {
    "primary": "Tetris Forever",
    "ja": "Tetris Forever",
    "en": "Tetris Forever"
  },
  "aliases": [
    {
      "text": "Tetris Forever",
      "normalized": "tetris forever",
      "kind": "official",
      "source": "steam_store:3180240"
    }
  ],
  "releases": [],
  "companies": [],
  "platforms": [
    "PC (Steam)"
  ],
  "external_ids": {
    "steam_app": 3180240
  },
  "sales_observations": [],
  "verification": {
    "status": "partially_verified",
    "checked_at": "2026-08-30",
    "sources": [
      {
        "type": "steam_store",
        "ref": "https://store.steampowered.com/app/3180240/"
      }
    ]
  }
}
