{
  "schema_version": 1,
  "id": "escape-simulator",
  "status": "active",
  "titles": {
    "primary": "脱出ルームシミュレーター",
    "ja": "脱出ルームシミュレーター",
    "en": "Escape Simulator"
  },
  "aliases": [
    {
      "text": "脱出ルームシミュレーター",
      "normalized": "脱出ルームシミュレーター",
      "kind": "official",
      "source": "steam_store:1435790"
    },
    {
      "text": "Escape Simulator",
      "normalized": "escape simulator",
      "kind": "official",
      "source": "steam_store:1435790"
    }
  ],
  "releases": [],
  "companies": [],
  "platforms": [
    "PC (Steam)"
  ],
  "external_ids": {
    "steam_app": 1435790
  },
  "sales_observations": [],
  "verification": {
    "status": "partially_verified",
    "checked_at": "2026-08-30",
    "sources": [
      {
        "type": "steam_store",
        "ref": "https://store.steampowered.com/app/1435790/"
      }
    ]
  }
}
